title	themes	acts_count	acts_ref_count	acts_book_count	url
My Apocrypha Seminar at the National Humanities Center: Part 2	Canon	1	0	0	https://ehrmanblog.org/my-apocrypha-seminar-at-the-national-humanities-center-part-2/
Jesus’ Final Speech in John:  A Lead-up to the Coming of the Spirit	Trinity	1	0	0	https://ehrmanblog.org/jesus-final-speech-in-john-a-lead-up-to-the-coming-of-the-spirit/
Introducing the Old Testament Apocrypha	Septuagint; Old Testament Apocrypha	1	0	0	https://ehrmanblog.org/introducing-the-old-testament-apocrypha/
How the Canon Itself Tames the Diversity of the New Testament	Canon; Early Christian Diversity	1	0	0	https://ehrmanblog.org/how-the-canon-itself-tames-the-diversity-of-the-new-testament/
How Christianity Grew and Grew	Conversion; Rise of Christianity; Miracles and Conversion	1	0	0	https://ehrmanblog.org/how-christianity-grew-and-grew/
Fifty Ways to Forge a Gospel	Forgery (General)	1	0	0	https://ehrmanblog.org/fifty-ways-to-forge-a-gospel/
Does Luke Combat a Docetic Christology?	Gospel of Luke; Christology in the Gospels	1	0	0	https://ehrmanblog.org/does-luke-combat-a-docetic-christology/
Does James Contradict Paul?	Biblical Contradictions (General)	1	0	0	https://ehrmanblog.org/does-james-contradict-paul/
Did Paul Invent the Resurrection?	Resurrection of Jesus; Early Christianity; Paul and Resurrection	1	0	0	https://ehrmanblog.org/did-paul-invent-the-resurrection/
Another Instance of Gematria	Letter of Barnabas; Gematria	1	0	0	https://ehrmanblog.org/another-instance-of-gematria/
ANT: Methods of Biblical Interpretation in the Early Church	Valentinian Gnostics; Gnosticism and Proto-Orthodoxy	1	0	0	https://ehrmanblog.org/ant-methods-of-biblical-interpretation-in-the-early-church/
A Very Odd Story about the Baby Jesus	Proto-Gospel of James; Birth Narrative	1	0	0	https://ehrmanblog.org/a-very-odd-story-about-the-baby-jesus/
A Christian Forger Caught in the Acts	Forgery (General)	1	0	0	https://ehrmanblog.org/a-christian-forger-caught-in-the-acts/
What Is (Sexually) “Unnatural”?	Sexual and Reproductive Ethics	0	0	0	https://ehrmanblog.org/what-is-sexually-unnatural/
Vespasian Miracles. A Platinum Post by Ryan Fleming	Ancient Miracle Workers	0	0	0	https://ehrmanblog.org/vespasian-miracles-a-platinum-post-by-ryan-fleming/
The Ethical Teachings of the Didache	Didache; Early Christian Views on Wealth	0	0	0	https://ehrmanblog.org/the-ethical-teachings-of-the-didache/
The Didache: An Important Early Christian Document in a Nutshell	In a Nutshell Series; Didache; Early Christian Views on Wealth	0	0	0	https://ehrmanblog.org/the-didache-an-important-early-christian-document-in-a-nutshell/
Suffering, Evil, and the Range Effect  Platinum Guest Post by Dennis J. Folds, Ph.D.	Problem of Suffering (General)	0	0	0	https://ehrmanblog.org/suffering-evil-and-the-range-effect-platinum-guest-post-by-dennis-j-folds-ph-d/
Melito and arly Christian Anti-Judaism	Anti-Judaism	0	0	0	https://ehrmanblog.org/melito-and-arly-christian-anti-judaism/
Is There Anything “Religious” about “Ethics”?	Early Judaism; Greco-Roman Religion; Moral Philosophy	0	0	0	https://ehrmanblog.org/is-there-anything-religious-about-ethics/
Homosexuality and the New Testament.  Guest Post by Jeff Siker.	Translation Process; Homosexuality	0	0	0	https://ehrmanblog.org/homosexuality-and-the-new-testament-guest-post-by-jeff-siker/
God is Holy and You Better Worship Him!	Divine Judgment; Jewish Law	0	0	0	https://ehrmanblog.org/god-is-holy-and-you-better-worship-him/
Fabrication, Forgery, and Accusations of (Heretical) Christian Licentious Rituals!	Mary Magdalene; Forgery (General)	0	0	0	https://ehrmanblog.org/fabrication-forgery-and-accusations-of-heretical-christian-licentious-rituals/
Early Christian Views of Judaism, In a Nutshell	In a Nutshell Series; Marcion; Jewish Law	0	0	0	https://ehrmanblog.org/early-christian-views-of-judaism-in-a-nutshell/
Does the New Testament Condemn Modern Practices of Homosexuality?	Homosexuality	0	0	0	https://ehrmanblog.org/does-the-new-testament-condemn-modern-practices-of-homosexuality/
Does Altruism Even Exist?  Some Personal Reflections Based on a Crazy Anecdote	Personal Reflections; Charity	0	0	0	https://ehrmanblog.org/does-altruism-even-exist-some-personal-reflections-based-on-a-crazy-anecdote/
Destroy More Others!  The Israelites’ Conquest of the City Ai	Divine Judgment; Moral Problems in Scripture	0	0	0	https://ehrmanblog.org/destroy-more-others-the-israelites-conquest-of-the-city-ai/
Day Two of Jesus and Brian	Life of Brian	0	0	0	https://ehrmanblog.org/day-two-of-jesus-and-brian/
Another Puzzling Figure in the Hebrew Bible: Woman Wisdom?	Divine Beings	0	0	0	https://ehrmanblog.org/another-puzzling-figure-in-the-hebrew-bible-woman-wisdom/
